{
  "meta": {
    "ontology_revision": "0.1.0",
    "generated_by": "iso-agent bootstrap",
    "generated_at": "2026-10-22"
  },
  "entities": [
    { "id": "person:P01", "type": "Person", "name": "윤승용" },
    { "id": "person:P02", "type": "Person", "name": "정서진" },
    { "id": "person:P03", "type": "Person", "name": "김철수" },
    { "id": "person:P04", "type": "Person", "name": "홍길순" },
    { "id": "person:P05", "type": "Person", "name": "김영희" },
    { "id": "person:P06", "type": "Person", "name": "박문수" },
    { "id": "person:P07", "type": "Person", "name": "이개발" },
    { "id": "person:P08", "type": "Person", "name": "한지우" },
    { "id": "person:P09", "type": "Person", "name": "오수빈" },
    { "id": "person:P10", "type": "Person", "name": "정민재" },
    { "id": "person:P11", "type": "Person", "name": "강도윤" },
    { "id": "person:P12", "type": "Person", "name": "임서현" },
    { "id": "person:P13", "type": "Person", "name": "최운영" },
    { "id": "person:P14", "type": "Person", "name": "장현우" },
    { "id": "person:P15", "type": "Person", "name": "홍길동" },
    { "id": "role:ceo", "type": "Role", "name": "대표이사" },
    { "id": "role:cto", "type": "Role", "name": "기술책임자·AIMS책임자" },
    { "id": "role:ai-safety", "type": "Role", "name": "인공지능안전관리자" },
    { "id": "role:admin-ops", "type": "Role", "name": "총무·문서관리" },
    { "id": "role:staff", "type": "Role", "name": "일반 구성원" },
    { "id": "perm:doc.read", "type": "Permission", "name": "doc.read" },
    { "id": "perm:record.read", "type": "Permission", "name": "record.read" },
    { "id": "perm:record.write", "type": "Permission", "name": "record.write" },
    { "id": "perm:record.scan", "type": "Permission", "name": "record.scan" },
    { "id": "perm:fact.approve", "type": "Permission", "name": "fact.approve" },
    { "id": "perm:seed.import", "type": "Permission", "name": "seed.import" },
    { "id": "perm:query.ask", "type": "Permission", "name": "query.ask" },
    { "id": "perm:impact.draft", "type": "Permission", "name": "impact.draft" },
    { "id": "perm:wiki.read", "type": "Permission", "name": "wiki.read" },
    { "id": "perm:wiki.write", "type": "Permission", "name": "wiki.write" },
    { "id": "aisystem:edu-score", "type": "AISystem", "name": "Edu Score" },
    { "id": "doc:AIDU-AIM-01-01", "type": "Document", "name": "문서체계 매뉴얼" },
    { "id": "doc:AIDU-AIP-06-01", "type": "Document", "name": "리스크 평가 및 처리절차서" },
    { "id": "doc:AIDU-AIP-06-02", "type": "Document", "name": "시스템 영향평가절차서" },
    { "id": "doc:AIDU-AIG-08-01", "type": "Document", "name": "인공지능경영활동관리규정" },
    { "id": "req:42001-6.1.4", "type": "Requirement", "name": "AI 시스템 영향평가 (6.1.4)" },
    { "id": "req:42001-6.1.2", "type": "Requirement", "name": "AI 리스크 평가 (6.1.2)" },
    { "id": "req:42001-8.4", "type": "Requirement", "name": "영향평가 운영 (8.4)" },
    { "id": "tpl:AIDU-AIP-06-01-F01", "type": "RecordTemplate", "name": "리스크·기회 식별대장" },
    { "id": "tpl:AIDU-AIP-06-01-F02", "type": "RecordTemplate", "name": "리스크 평가표" },
    { "id": "tpl:AIDU-AIP-06-02-F01", "type": "RecordTemplate", "name": "영향평가 계획·범위서" },
    { "id": "tpl:AIDU-AIP-06-02-F02", "type": "RecordTemplate", "name": "영향평가서" },
    { "id": "tpl:AIDU-AIP-06-02-F03", "type": "RecordTemplate", "name": "영향평가 결과 제공·갱신표" },
    { "id": "tpl:AIDU-AIP-06-02-F04", "type": "RecordTemplate", "name": "윤리 쟁점·대안 검토서" },
    { "id": "activity:impact-assessment", "type": "Activity", "name": "시스템 영향평가" },
    { "id": "activity:risk-assessment", "type": "Activity", "name": "리스크 평가·처리" }
  ],
  "facts": [
    { "id": "fact:seed:hr-p01", "subject": "person:P01", "predicate": "holds_role", "object": "role:ceo", "status": "approved" },
    { "id": "fact:seed:hr-p03", "subject": "person:P03", "predicate": "holds_role", "object": "role:cto", "status": "approved" },
    { "id": "fact:seed:hr-p15", "subject": "person:P15", "predicate": "holds_role", "object": "role:ai-safety", "status": "approved" },
    { "id": "fact:seed:hr-p04", "subject": "person:P04", "predicate": "holds_role", "object": "role:admin-ops", "status": "approved" },
    { "id": "fact:seed:hr-p02", "subject": "person:P02", "predicate": "holds_role", "object": "role:staff", "status": "approved" },
    { "id": "fact:seed:hr-p05", "subject": "person:P05", "predicate": "holds_role", "object": "role:staff", "status": "approved" },
    { "id": "fact:seed:hr-p06", "subject": "person:P06", "predicate": "holds_role", "object": "role:staff", "status": "approved" },
    { "id": "fact:seed:hr-p07", "subject": "person:P07", "predicate": "holds_role", "object": "role:staff", "status": "approved" },
    { "id": "fact:seed:hr-p08", "subject": "person:P08", "predicate": "holds_role", "object": "role:staff", "status": "approved" },
    { "id": "fact:seed:hr-p09", "subject": "person:P09", "predicate": "holds_role", "object": "role:staff", "status": "approved" },
    { "id": "fact:seed:hr-p10", "subject": "person:P10", "predicate": "holds_role", "object": "role:staff", "status": "approved" },
    { "id": "fact:seed:hr-p11", "subject": "person:P11", "predicate": "holds_role", "object": "role:staff", "status": "approved" },
    { "id": "fact:seed:hr-p12", "subject": "person:P12", "predicate": "holds_role", "object": "role:staff", "status": "approved" },
    { "id": "fact:seed:hr-p13", "subject": "person:P13", "predicate": "holds_role", "object": "role:staff", "status": "approved" },
    { "id": "fact:seed:hr-p14", "subject": "person:P14", "predicate": "holds_role", "object": "role:staff", "status": "approved" },

    { "id": "fact:seed:g-ceo-1", "subject": "role:ceo", "predicate": "grants", "object": "perm:doc.read", "status": "approved" },
    { "id": "fact:seed:g-ceo-2", "subject": "role:ceo", "predicate": "grants", "object": "perm:record.read", "status": "approved" },
    { "id": "fact:seed:g-ceo-3", "subject": "role:ceo", "predicate": "grants", "object": "perm:query.ask", "status": "approved" },
    { "id": "fact:seed:g-ceo-4", "subject": "role:ceo", "predicate": "grants", "object": "perm:impact.draft", "status": "approved" },
    { "id": "fact:seed:g-ceo-5", "subject": "role:ceo", "predicate": "grants", "object": "perm:wiki.read", "status": "approved" },
    { "id": "fact:seed:g-ceo-6", "subject": "role:ceo", "predicate": "grants", "object": "perm:fact.approve", "status": "approved" },
    { "id": "fact:seed:g-ceo-7", "subject": "role:ceo", "predicate": "grants", "object": "perm:seed.import", "status": "approved" },

    { "id": "fact:seed:g-cto-1", "subject": "role:cto", "predicate": "grants", "object": "perm:doc.read", "status": "approved" },
    { "id": "fact:seed:g-cto-2", "subject": "role:cto", "predicate": "grants", "object": "perm:record.read", "status": "approved" },
    { "id": "fact:seed:g-cto-3", "subject": "role:cto", "predicate": "grants", "object": "perm:record.write", "status": "approved" },
    { "id": "fact:seed:g-cto-4", "subject": "role:cto", "predicate": "grants", "object": "perm:record.scan", "status": "approved" },
    { "id": "fact:seed:g-cto-5", "subject": "role:cto", "predicate": "grants", "object": "perm:fact.approve", "status": "approved" },
    { "id": "fact:seed:g-cto-6", "subject": "role:cto", "predicate": "grants", "object": "perm:seed.import", "status": "approved" },
    { "id": "fact:seed:g-cto-7", "subject": "role:cto", "predicate": "grants", "object": "perm:query.ask", "status": "approved" },
    { "id": "fact:seed:g-cto-8", "subject": "role:cto", "predicate": "grants", "object": "perm:impact.draft", "status": "approved" },
    { "id": "fact:seed:g-cto-9", "subject": "role:cto", "predicate": "grants", "object": "perm:wiki.read", "status": "approved" },
    { "id": "fact:seed:g-cto-10", "subject": "role:cto", "predicate": "grants", "object": "perm:wiki.write", "status": "approved" },

    { "id": "fact:seed:g-ais-1", "subject": "role:ai-safety", "predicate": "grants", "object": "perm:doc.read", "status": "approved" },
    { "id": "fact:seed:g-ais-2", "subject": "role:ai-safety", "predicate": "grants", "object": "perm:record.read", "status": "approved" },
    { "id": "fact:seed:g-ais-3", "subject": "role:ai-safety", "predicate": "grants", "object": "perm:record.write", "status": "approved" },
    { "id": "fact:seed:g-ais-4", "subject": "role:ai-safety", "predicate": "grants", "object": "perm:record.scan", "status": "approved" },
    { "id": "fact:seed:g-ais-5", "subject": "role:ai-safety", "predicate": "grants", "object": "perm:fact.approve", "status": "approved" },
    { "id": "fact:seed:g-ais-6", "subject": "role:ai-safety", "predicate": "grants", "object": "perm:query.ask", "status": "approved" },
    { "id": "fact:seed:g-ais-7", "subject": "role:ai-safety", "predicate": "grants", "object": "perm:impact.draft", "status": "approved" },
    { "id": "fact:seed:g-ais-8", "subject": "role:ai-safety", "predicate": "grants", "object": "perm:wiki.read", "status": "approved" },
    { "id": "fact:seed:g-ais-9", "subject": "role:ai-safety", "predicate": "grants", "object": "perm:wiki.write", "status": "approved" },

    { "id": "fact:seed:g-adm-1", "subject": "role:admin-ops", "predicate": "grants", "object": "perm:doc.read", "status": "approved" },
    { "id": "fact:seed:g-adm-2", "subject": "role:admin-ops", "predicate": "grants", "object": "perm:record.read", "status": "approved" },
    { "id": "fact:seed:g-adm-3", "subject": "role:admin-ops", "predicate": "grants", "object": "perm:record.write", "status": "approved" },
    { "id": "fact:seed:g-adm-4", "subject": "role:admin-ops", "predicate": "grants", "object": "perm:record.scan", "status": "approved" },
    { "id": "fact:seed:g-adm-5", "subject": "role:admin-ops", "predicate": "grants", "object": "perm:seed.import", "status": "approved" },
    { "id": "fact:seed:g-adm-6", "subject": "role:admin-ops", "predicate": "grants", "object": "perm:query.ask", "status": "approved" },
    { "id": "fact:seed:g-adm-7", "subject": "role:admin-ops", "predicate": "grants", "object": "perm:wiki.read", "status": "approved" },